date	title	cat1	cat2	url	post_text
December 6, 2018	Facebook Subscriptions Test Expands to more Publishers	ANNOUNCEMENTS		https://www.facebook.com/formedia/blog/facebook-subscriptions-test-expands-to-more-publishers	
December 6, 2018	Facebook Expands Subscriptions Test to More Publishers	ANNOUNCEMENTS	JOURNALISM	https://www.facebook.com/journalismproject/facebook-subscriptions-test-expands-more-publishers	
December 3, 2018	Inside the Membership Accelerator: 10 Essential Ingredients to Building a Membership-Based News Organization	ANNOUNCEMENTS		https://www.facebook.com/formedia/blog/inside-the-membership-accelerator-10-essential-ingredients-to-building-a-membership-based-news-organization	
December 3, 2018	10 Essential Tips to Build a Membership-Based News Organization	BEST PRACTICES	JOURNALISM	https://www.facebook.com/journalismproject/tips-for-membership-news-organizations	
November 29, 2018	Updates to our Ad Transparency and Authorisation Efforts	ANNOUNCEMENTS		https://www.facebook.com/formedia/blog/updates-to-our-ads-transparency-and-authorisation-efforts	
November 28, 2018	The Facebook Journalism Project partners with the International Center for Journalists to launch journalist training program in Middle East and North Africa	ANNOUNCEMENTS		https://www.facebook.com/formedia/blog/the-facebook-journalism-project-partners-with-the-international-center-for-journalists-to-launch-journalist-training-program-in-middle-east-and-north-africa	
November 28, 2018	Facebook Launches the Social Media Solutions Program	ANNOUNCEMENTS	JOURNALISM	https://www.facebook.com/journalismproject/facebook-social-media-solutions-program	
November 28, 2018	How NBB used Facebook Live to Drive Incremental Business Results	SUCCESS STORIES	MEDIA	https://www.facebook.com/facebookmedia/success-stories/how-nbb-used-facebook-live-to-drive-incremental-business-results	
November 26, 2018	Creator Spotlight: What's Cooking | Meta for Creators	SUCCESS STORIES	CREATORS	https://www.facebook.com/creators/creator-spotlight-whats-cooking	
November 26, 2018	The Walking Dead uses Facebook Live and Groups to Engage Fans	SUCCESS STORIES	MEDIA	https://www.facebook.com/facebookmedia/success-stories/the-walking-dead-uses-facebook-live-and-groups-to-engage-fans	
November 20, 2018	Webinar: Getting Started with Fan Subscriptions | Facebook for Creators	BEST PRACTICES	CREATORS	https://www.facebook.com/creators/webinar-getting-started-with-fan-subscriptions	
November 20, 2018	Spotlight on Local News: How California News Publishers Are Covering the Wildfires on Facebook	ANNOUNCEMENTS		https://www.facebook.com/formedia/blog/spotlight-on-local-how-california-news-publishers-are-covering-the-wildfires-on-facebook	
November 20, 2018	How California Newsrooms Covered the Wildfires on Facebook	SUCCESS STORIES	JOURNALISM	https://www.facebook.com/journalismproject/california-wildfires-facebook	
November 19, 2018	Facebook Launches UK Community News Project	ANNOUNCEMENTS		https://www.facebook.com/formedia/blog/facebook-uk-community-news-project-launch	
November 19, 2018	Facebook launches Community News Project in the UK	ANNOUNCEMENTS		https://www.facebook.com/formedia/blog/facebook-launches-community-news-project-in-the-uk	
November 16, 2018	Recap: Creator Day São Paulo 2018 | Meta for Creators	ANNOUNCEMENTS	CREATORS	https://www.facebook.com/creators/sao-paulo-creator-day	
November 15, 2018	Expert Tips to Improve Your Video Storytelling	SUCCESS STORIES	JOURNALISM	https://www.facebook.com/journalismproject/improve-video-storytelling	
June 30, 2021	The Players' Tribune Finds Success Expanding to Video-First Storytelling	SUCCESS STORIES	MEDIA	https://www.facebook.com/facebookmedia/success-stories/the-players-tribune-finds-success-expanding-to-video-first-storytelling	
November 15, 2018	Inside the Digital Video Accelerator: Tips on Improving Video Storytelling in Pre-Production, Creation, and Distribution	ANNOUNCEMENTS		https://www.facebook.com/formedia/blog/inside-the-digital-video-accelerator-tips-on-improving-video-storytelling-in-pre-production-creation-and-distribution	
November 12, 2018	Unlocking Fan Subscription Success | Meta for Creators	BEST PRACTICES	CREATORS	https://www.facebook.com/creators/unlocking-fan-subscriptions-success	
November 8, 2018	Inside the Digital Video Accelerator: How to Get Started With Digital Video	ANNOUNCEMENTS		https://www.facebook.com/formedia/blog/inside-the-digital-video-accelerator-how-to-get-started-with-digital-video	
November 8, 2018	Getting Started with Fan Subscriptions | Meta for Creators	BEST PRACTICES	CREATORS	https://www.facebook.com/creators/getting-started-with-fan-subscriptions	
November 7, 2018	Inside the Membership Accelerator: Five Steps to a Stronger Membership Program	ANNOUNCEMENTS		https://www.facebook.com/formedia/blog/inside-the-membership-accelerator-five-steps-to-a-stronger-membership-program	
November 6, 2018	5 Steps to a Stronger Membership Program	BEST PRACTICES	JOURNALISM	https://www.facebook.com/journalismproject/membership-program-news	
November 5, 2018	How the San Francisco Chronicle Increased Digital Subscriptions	SUCCESS STORIES	JOURNALISM	https://www.facebook.com/journalismproject/san-francisco-chronicle-subscription	
November 5, 2018	Inside the Digital Subscriptions Accelerator: How the San Francisco Chronicle Increased Digital Subscriptions	ANNOUNCEMENTS		https://www.facebook.com/formedia/blog/inside-the-digital-subscriptions-accelerator-how-the-san-francisco-chronicle-increased-digital-subscriptions	
November 1, 2018	Expanding Breaking News on Facebook	ANNOUNCEMENTS		https://www.facebook.com/formedia/blog/expanding-breaking-news-on-facebook	
October 31, 2018	Halloween Makeup Tutorials | Facebook for Creators	SUCCESS STORIES	CREATORS	https://www.facebook.com/creators/halloween-makeup-tutorials	
October 31, 2018	The South China Morning Post is in the middle of a digital transformation. Here's how they use CrowdTangle to sharpen their social strategy.	SUCCESS STORIES		https://www.facebook.com/formedia/blog/the-south-china-morning-post-is-in-the-middle-of-a-digital-transformation-heres-how-they-use-crowdtangle-to-sharpen-their-social-strategy	
October 30, 2018	James Patterson Releases Novel Exclusively on Messenger	ANNOUNCEMENTS		https://www.facebook.com/formedia/blog/james-patterson-releases-novel-exclusively-on-messenger	
October 30, 2018	How to Get Started With Digital Video	BEST PRACTICES	JOURNALISM	https://www.facebook.com/journalismproject/digital-video-get-started	
October 30, 2018	Unlocking Profitable Digital Membership	BEST PRACTICES	JOURNALISM	https://www.facebook.com/journalismproject/profitable-digital-membership	
October 30, 2018	Inside the Membership Accelerator: Finding Your Whales	ANNOUNCEMENTS		https://www.facebook.com/formedia/blog/inside-the-membership-accelerator-finding-your-whales	
October 26, 2018	Creator Spotlight: Strange Magic | Facebook for Creators	SUCCESS STORIES	CREATORS	https://www.facebook.com/creators/creator-spotlight-strange-magic	
October 24, 2018	Creator Studio Deep Dive | Meta for Creators	BEST PRACTICES	CREATORS	https://www.facebook.com/creators/creator-studio-deep-dive	
October 19, 2018	Facebook and Storyful Launch Training Program for Journalists	ANNOUNCEMENTS	JOURNALISM	https://www.facebook.com/journalismproject/facebook-storyful-training-program-journalists	
October 19, 2018	Inside the Digital Video Accelerator: Implementing a Digital Mindset	ANNOUNCEMENTS		https://www.facebook.com/formedia/blog/inside-the-digital-video-accelerator-implementing-a-digital-mindset	
October 19, 2018	The Facebook Journalism Project partners with Storyful to Launch Training Program for Journalists	ANNOUNCEMENTS		https://www.facebook.com/formedia/blog/the-facebook-journalism-project-partners-with-storyful-to-launch-training-program-for-journalists	
October 18, 2018	For Publishers, Video Requires a Digital-First Mindset	BEST PRACTICES	JOURNALISM	https://www.facebook.com/journalismproject/video-digital-mindset	
October 18, 2018	How Group Nine Built a Dynamic Video Strategy and Monetized It Through In-stream Ads	SUCCESS STORIES		https://www.facebook.com/formedia/blog/how-group-nine-built-a-dynamic-video-strategy-and-monetized-it-through-ad-breaks	
October 18, 2018	Updates to Branded Content and Brand Collaborations on Facebook	ANNOUNCEMENTS		https://www.facebook.com/formedia/blog/updates-to-branded-content-and-brand-collaborations-on-facebook	
October 18, 2018	Key Updates to Branded Content | Meta for Creators	ANNOUNCEMENTS	CREATORS	https://www.facebook.com/creators/key-updates-to-branded-content	
October 17, 2018	Authentic Live Content Drives More than 12 Million Views During Canadian Expedition	SUCCESS STORIES	MEDIA	https://www.facebook.com/facebookmedia/success-stories/authentic-live-content-drives-more-than-12-million-views-during-canadian-expedition	
October 11, 2018	International Day of the Girl | Facebook for Creators	SUCCESS STORIES	CREATORS	https://www.facebook.com/creators/international-day-of-the-girl	
October 10, 2018	Inside the Facebook Journalism Project's Local News Membership Accelerator: Recap of the Austin Kick Off	ANNOUNCEMENTS		https://www.facebook.com/formedia/blog/inside-the-facebook-journalism-projects-local-news-membership-accelerator-recap-of-the-austin-kick-off	
October 9, 2018	Lessons from the Facebook Journalism Project's Membership Accelerator	ANNOUNCEMENTS		https://www.facebook.com/formedia/blog/lessons-from-the-facebook-journalism-projects-membership-accelerator	
October 9, 2018	Quick Links Subscriptions Directory	ANNOUNCEMENTS		https://www.facebook.com/formedia/blog/quick-links-subscriptions-directory	
October 4, 2018	Inside the Digital Video Accelerator: Developing Your Digital Video Strategy	ANNOUNCEMENTS		https://www.facebook.com/formedia/blog/inside-the-digital-video-accelerator-developing-your-digital-video-strategy	
October 4, 2018	Take Your Digital Strategy to the Next Level	BEST PRACTICES	JOURNALISM	https://www.facebook.com/journalismproject/improve-digital-strategy	
October 2, 2018	Three New Ways to Engage Fans | Meta for Creators	BEST PRACTICES	CREATORS	https://www.facebook.com/creators/three-new-ways-to-engage-fans	
October 2, 2018	Global Launch of Premieres, Polls, and Top Fans	ANNOUNCEMENTS		https://www.facebook.com/formedia/blog/global-launch-of-premieres-polls-and-top-fans	
October 2, 2018	Lessons From the Digital Video Accelerator	ANNOUNCEMENTS		https://www.facebook.com/formedia/blog/lessons-from-the-digital-video-accelerator	
October 1, 2018	Monetization Eligibility Standards: Why would my Page be demonetized?	BEST PRACTICES		https://www.facebook.com/formedia/blog/monetization-eligibility-standards-why-would-my-page-be-demonetized	
September 24, 2018	Launching In-stream Ads in 21 New Countries	ANNOUNCEMENTS		https://www.facebook.com/formedia/blog/launching-ad-breaks-in-21-new-countries	
September 21, 2018	All About In-Stream Ads | Meta for Creators	BEST PRACTICES	CREATORS	https://www.facebook.com/creators/all-about-ad-breaks	
September 20, 2018	How Local Publishers Used Facebook to Cover Hurricane Florence	SUCCESS STORIES		https://www.facebook.com/formedia/blog/how-local-publishers-used-facebook-to-cover-hurricane-florence	
September 18, 2018	Indexing News Pages on Facebook	ANNOUNCEMENTS		https://www.facebook.com/formedia/blog/indexing-news-pages-on-facebook-for-the-ad-archive	
September 18, 2018	Universal Pictures Creates Cutting-Edge Facebook Content for “Jurassic World”	SUCCESS STORIES		https://www.facebook.com/formedia/blog/universal-pictures-creates-cutting-edge-facebook-content-for-jurassic-world	
September 14, 2018	Creator Spotlight: Family Fun | Facebook for Creators	SUCCESS STORIES	CREATORS	https://www.facebook.com/creators/creator-spotlight-family-fun	
September 14, 2018	CrowdTangle helped Townsquare Media's sales team increase revenue by more than $100k	SUCCESS STORIES		https://www.facebook.com/formedia/blog/crowdtangle-helped-townsquare-medias-sales-team-increase-revenue-by-more-than-100k	
September 12, 2018	Spotlight On Local News: The Texas Tribune Facilitates Sensitive Political Discussions Through Facebook Groups	ANNOUNCEMENTS		https://www.facebook.com/formedia/blog/spotlight-on-local-news-the-texas-tribune-facilitates-sensitive-political-discussions-through-facebook-groups	
September 12, 2018	How Local Publishing Groups Are Using Facebook Groups to Connect with Readers	ANNOUNCEMENTS		https://www.facebook.com/formedia/blog/how-local-publishing-groups-are-using-facebook-groups-to-connect-with-readers	
September 11, 2018	Local News Publishers Use Facebook Groups to Connect With Readers	SUCCESS STORIES	JOURNALISM	https://www.facebook.com/journalismproject/local-news-facebook-groups	
September 6, 2018	Wuz Good's Rise and Grind| Meta for Creators	SUCCESS STORIES	CREATORS	https://www.facebook.com/creators/wuz-good-rise-and-grind	
August 29, 2018	Watch Out! | Meta for Creators	ANNOUNCEMENTS	CREATORS	https://www.facebook.com/creators/watch-out	
August 29, 2018	Launching Watch, In-stream Ads & Creator Studio Globally	ANNOUNCEMENTS		https://www.facebook.com/formedia/blog/launching-watch-ad-breaks-creator-studio-globally	
August 23, 2018	Video Best Practices	BEST PRACTICES		https://www.facebook.com/formedia/blog/video-best-practices	
August 23, 2018	Best Practices for Avoiding Sharing Schemes	BEST PRACTICES		https://www.facebook.com/formedia/blog/best-practices-for-avoiding-sharing-schemes	
August 23, 2018	Chef's Indian Premier League Playlist Generates 13M Views	SUCCESS STORIES	MEDIA	https://www.facebook.com/facebookmedia/success-stories/chefs-indian-premier-league-playlist-generates-13m-views	
August 21, 2018	News Anchor Bob Herzog Shares 5 Tips for Using Facebook Live	BEST PRACTICES	JOURNALISM	https://www.facebook.com/journalismproject/bob-herzog-wake-up-make-up-facebook-live	
August 21, 2018	Spotlight on Local News: Anchor Bob Herzog Shares 5 Tips for Using Facebook Live	ANNOUNCEMENTS		https://www.facebook.com/formedia/blog/spotlight-on-local-news-anchor-bob-herzog-shares-5-tips-for-using-facebook-live	
August 20, 2018	Inside the Local News Subscriptions Accelerator: Optimizing Your Checkout Flow	ANNOUNCEMENTS		https://www.facebook.com/formedia/blog/inside-the-local-news-subscriptions-accelerator-optimizing-your-checkout-flow	
August 20, 2018	How to Optimize Your Checkout Flow	BEST PRACTICES	JOURNALISM	https://www.facebook.com/journalismproject/checkout-flow-optimization	
August 15, 2018	The Facebook Journalism Project partners with the News Literacy Project to expand its news literacy classroom for students	ANNOUNCEMENTS		https://www.facebook.com/formedia/blog/the-facebook-journalism-project-partners-with-the-news-literacy-project-to-expand-its-news-literacy-classroom-for-students	
August 15, 2018	NASCAR and Bubba Wallace Find Marketing Formula for Facebook Watch	SUCCESS STORIES		https://www.facebook.com/formedia/blog/nascar-and-bubba-wallace-find-marketing-formula-for-facebook-watch	
August 15, 2018	Facebook Project Prioritizes Student News Literacy	ANNOUNCEMENTS	JOURNALISM	https://www.facebook.com/journalismproject/facebook-student-news-literacy	
August 14, 2018	Creator Spotlight: Motivational Makers | Meta for Creators	SUCCESS STORIES	CREATORS	https://www.facebook.com/creators/creator-spotlight-motivational-makers	
August 14, 2018	Creator Spotlight: Animal Spirit | Facebook for Creators	SUCCESS STORIES	CREATORS	https://www.facebook.com/creators/creator-spotlight-animal-spirit	
August 13, 2018	Best Practices for Facebook and Instagram	BEST PRACTICES		https://www.facebook.com/formedia/blog/best-practices-for-facebook-and-instagram	
August 9, 2018	Inside the Local News Subscriptions Accelerator: Mastering the Mid-Funnel	ANNOUNCEMENTS		https://www.facebook.com/formedia/blog/inside-the-local-news-subscriptions-accelerator-mastering-the-mid-funnel	
August 8, 2018	How to Nurture Business With Mid-Funnel Marketing	BEST PRACTICES	JOURNALISM	https://www.facebook.com/journalismproject/mid-funnel-marketing	
August 2, 2018	Stephen Curry Raises $82K To Fight Malaria Through Facebook's Donate Button	SUCCESS STORIES	MEDIA	https://www.facebook.com/facebookmedia/success-stories/stephen-curry-raises-82k-to-fight-malaria-through-facebooks-donate-button	
August 2, 2018	The Next Step in Our Journey to Help Local News Publishers	ANNOUNCEMENTS	JOURNALISM	https://www.facebook.com/journalismproject/facebook-next-step-in-journey-news-publishers	
August 2, 2018	Inside the Local News Subscriptions Accelerator: Publishers Share Their Results	ANNOUNCEMENTS		https://www.facebook.com/formedia/blog/inside-the-local-news-subscriptions-accelerator-publishers-share-their-results	
August 2, 2018	The Next Step in our Journey to Help Local News Publishers	ANNOUNCEMENTS		https://www.facebook.com/formedia/blog/the-next-step-in-our-journey-to-help-local-news-publishers	
August 2, 2018	Publishers See Results With the Facebook Accelerator Program	SUCCESS STORIES	JOURNALISM	https://www.facebook.com/journalismproject/results-facebook-accelerator-program	
August 1, 2018	Spotlight on Local News: CrowdTangle is Bringing one of Connecticut’s Oldest Local News Stations into the Future	ANNOUNCEMENTS		https://www.facebook.com/formedia/blog/crowdtangle-is-bringing-one-of-connecticuts-oldest-local-news-stations-into-the-future	
July 30, 2018	Cricket Australia Goes Live to Bring WBBL to Wider Audience	SUCCESS STORIES	MEDIA	https://www.facebook.com/facebookmedia/success-stories/cricket-australia-goes-live-to-bring-wbbl-to-wider-audience	
July 30, 2018	Introducing Brand Collabs Manager | Meta for Creators	BEST PRACTICES	CREATORS	https://www.facebook.com/creators/introducing-brand-collabs-manager	
July 24, 2018	Inside the Local News Subscriptions Accelerator: Menlo Park Recap	ANNOUNCEMENTS		https://www.facebook.com/formedia/blog/inside-the-local-news-subscriptions-accelerator-menlo-park-recap	
July 23, 2018	A Fresh Look for Your Page | Meta for Creators	BEST PRACTICES	CREATORS	https://www.facebook.com/creators/a-fresh-look-for-your-page	
July 18, 2018	How to Improve Marketing Operations for Subscription Campaigns	SUCCESS STORIES	JOURNALISM	https://www.facebook.com/journalismproject/marketing-subscription-campaigns	
July 18, 2018	Inside the Local News Subscriptions Accelerator: Lessons in Marketing Operations	ANNOUNCEMENTS		https://www.facebook.com/formedia/blog/inside-the-local-news-subscriptions-accelerator-lessons-in-marketing-operations	
July 11, 2018	How to Watch the First Funded News Shows on Facebook Watch	SUCCESS STORIES		https://www.facebook.com/formedia/blog/how-to-watch-the-first-funded-news-shows-on-facebook-watch	
July 9, 2018	UCF Knights' Content Plan Leads to Top 5 Division I Ranking in Facebook Engagement and Growth	SUCCESS STORIES	MEDIA	https://www.facebook.com/facebookmedia/success-stories/the-university-of-central-florida-demonstrated-the-impact-of-creating-engaging-content-to-drive-conversation	
June 28, 2018	Facebook helps coalition of 24 news organizations fight misinformation in Brazil	ANNOUNCEMENTS		https://www.facebook.com/formedia/blog/facebook-helps-coalition-of-24-news-organizations-fight-misinformation-in-brazil	
June 28, 2018	Facebook Helps Brazil News Organizations Fight Misinformation	SUCCESS STORIES	JOURNALISM	https://www.facebook.com/journalismproject/facebook-helps-brazil-news-organizations-fight-misinformation	
June 28, 2018	Best Practices for Driving Discussions Around Your Videos	BEST PRACTICES		https://www.facebook.com/formedia/blog/best-practices-for-driving-discussions-around-your-videos	
June 27, 2018	Investing in News Subscriptions	ANNOUNCEMENTS		https://www.facebook.com/formedia/blog/investing-in-news-subscriptions	
June 27, 2018	Facebook Invests in News Subscriptions	ANNOUNCEMENTS	JOURNALISM	https://www.facebook.com/journalismproject/facebook-invests-news-subscriptions	
June 25, 2018	PVR Cinemas Debut In-Theater Facebook Live with Dharma Productions	ANNOUNCEMENTS	MEDIA	https://www.facebook.com/facebookmedia/success-stories/pvr-cinemas-debut-in-theater-facebook-live-with-dharma-productions	
June 25, 2018	Recap: Creator Day and VidCon US 2018 | Meta for Creators	ANNOUNCEMENTS	CREATORS	https://www.facebook.com/creators/creator-day-and-vidcon-recap	
June 19, 2018	Grow Your Fanbase | Meta for Creators	BEST PRACTICES	CREATORS	https://www.facebook.com/creators/grow-your-fanbase	
June 19, 2018	Up-level your videos | Meta for Creators	BEST PRACTICES	CREATORS	https://www.facebook.com/creators/up-level-your-videos	
June 19, 2018	Getting Started with Tools | Facebook for Creators	BEST PRACTICES	CREATORS	https://www.facebook.com/creators/getting-started-with-tools	
June 19, 2018	Making Video More Interactive	BEST PRACTICES		https://www.facebook.com/formedia/blog/making-video-more-interactive	
June 19, 2018	Enhance Audience Engagement | Meta for Creators	BEST PRACTICES	CREATORS	https://www.facebook.com/creators/enhance-audience-engagement	
June 19, 2018	Keeping Content Safe and Authentic | Meta for Creators	BEST PRACTICES	CREATORS	https://www.facebook.com/creators/keeping-content-safe	
June 15, 2018	Josh Talks Expands Audience With Facebook Videos in Vernacular Languages	SUCCESS STORIES	MEDIA	https://www.facebook.com/facebookmedia/success-stories/josh-talks-expands-audience-with-facebook-video-in-vernacular-languages	
June 14, 2018	Creator Spotlight: For Your Entertainment | Meta for Creators	SUCCESS STORIES	CREATORS	https://www.facebook.com/creators/creator-spotlight-for-your-entertainment	
June 14, 2018	Facebook Blueprint Courses for Journalists and Publishers	ANNOUNCEMENTS	JOURNALISM	https://www.facebook.com/journalismproject/facebook-blueprint-courses-journalists-publishers	
June 14, 2018	Announcing two new Facebook Journalism Project + Poynter Institute online courses	ANNOUNCEMENTS		https://www.facebook.com/formedia/blog/announcing-two-new-facebook-journalism-project-poynter-institute-online-courses	
June 14, 2018	Happy Pride! | Meta for Creators	SUCCESS STORIES	CREATORS	https://www.facebook.com/creators/happy-pride	
June 13, 2018	Authorizing Ads with Political Content: Why Publishers Are Included	ANNOUNCEMENTS		https://www.facebook.com/formedia/blog/authorizing-ads-with-political-content-why-publishers-are-included	
June 12, 2018	Inside the Local News Subscriptions Accelerator: Testing in Seattle	ANNOUNCEMENTS		https://www.facebook.com/formedia/blog/inside-the-local-news-subscriptions-accelerator-testing-in-seattle	
June 6, 2018	BILD's CrowdTangle Blueprint: Finding Diamond-In-the-Rough Stories and Making Them Pop Across 75 Facebook Pages	SUCCESS STORIES		https://www.facebook.com/formedia/blog/bilds-crowdtangle-blueprint-finding-diamond-in-the-rough-stories-and-making-them-pop-across-75-facebook-pages	
June 6, 2018	Introducing the First Funded News Shows for Facebook Watch	ANNOUNCEMENTS		https://www.facebook.com/formedia/blog/introducing-the-first-funded-news-shows-for-facebook-watch	
June 5, 2018	Newsroom Support Is Key to Promoting Digital Subscriptions	BEST PRACTICES	JOURNALISM	https://www.facebook.com/journalismproject/digital-subscription-offers	
June 5, 2018	Newsroom Support Is Key to Promoting Digital Subscriptions	BEST PRACTICES	JOURNALISM	https://www.facebook.com/journalismproject/digital-subscriptions-newsroom	
June 5, 2018	Inside the Local News Subscriptions Accelerator: Leveraging Your Newsroom to Promote Digital Subscriptions	ANNOUNCEMENTS		https://www.facebook.com/formedia/blog/inside-the-local-news-subscriptions-accelerator-leveraging-your-newsroom-to-promote-digital-subscriptions	
June 5, 2018	Mexican National League Brings Live Basketball Games to Facebook	SUCCESS STORIES	MEDIA	https://www.facebook.com/facebookmedia/success-stories/mexican-national-league-brings-live-basketball-games-to-facebook	
June 5, 2018	Creator Spotlight: Art of Beauty | Facebook for Creators	SUCCESS STORIES	CREATORS	https://www.facebook.com/creators/creator-spotlight-art-of-beauty	
May 31, 2018	8 Alternate Tactics to Acquire Subscriptions	BEST PRACTICES	JOURNALISM	https://www.facebook.com/journalismproject/acquire-subscriptions	
May 31, 2018	Inside the Local News Subscriptions Accelerator: 8 Alternate Ways of Acquiring Digital Subscribers	ANNOUNCEMENTS		https://www.facebook.com/formedia/blog/inside-the-local-news-subscriptions-accelerator-8-alternate-subs	
May 25, 2018	CrowdTangle Can Save Your News Company $200,000. Lessons from Deutsche Welle	SUCCESS STORIES		https://www.facebook.com/formedia/blog/crowdtangle-can-save-your-news-company-200000-lessons-from-deutsche-welle	
May 24, 2018	Creator Spotlight: Funny Business | Facebook for Creators	SUCCESS STORIES	CREATORS	https://www.facebook.com/creators/creator-spotlight-funny-business	
May 23, 2018	Inside the Local News Subscriptions Accelerator: Austin Meeting Recap	ANNOUNCEMENTS		https://www.facebook.com/formedia/blog/inside-the-local-news-subscriptions-accelerator-austin-recap	
May 23, 2018	Sports Illustrated Uses Instagram Stories Tools to Drive Engagement	SUCCESS STORIES	MEDIA	https://www.facebook.com/facebookmedia/success-stories/sports-illustrated-uses-instagram-stories-tools-to-drive-engagement	
May 18, 2018	Facebook for Business Influencers	ANNOUNCEMENTS		https://www.facebook.com/formedia/blog/businessinfluencers	
May 18, 2018	Get to Know Ms Yeah | Meta for Creators	SUCCESS STORIES	CREATORS	https://www.facebook.com/creators/get-to-know-ms-yeah	
May 18, 2018	Game Media Asia Network Uses CrowdTangle Slack Alerts to Level-Up	SUCCESS STORIES		https://www.facebook.com/formedia/blog/game-media-asia-network-uses-crowdtangle-slack-alerts-to-level-up	
May 17, 2018	The Facebook Journalism Project's Digital Journalism Fellowship	ANNOUNCEMENTS	JOURNALISM	https://www.facebook.com/journalismproject/facebook-journalism-project-digital-journalism-fellowship	
